{
 "schema_version": 1,
 "run_id": "run-5d1e7a0c9b42",
 "role": "inquisitor",
 "stage": "1",
 "attempt": 1,
 "status": "ok",
 "cost": {
  "usd": 0.0231
 },
 "model": "gpt-5",
 "payload": {
  "contract": {
   "schema_version": 1,
   "slice_id": "calc.media.v1",
   "source": "consensus",
   "functions": [
    {
     "name": "media",
     "signature": "def media(xs: list[float]) -> float",
     "pre": [
      "xs is a list of finite floats"
     ],
     "post": [
      "devuelve sum(xs) / len(xs)",
      "does not modify xs"
     ],
     "invariants": [
      "min(xs) <= media(xs) <= max(xs)"
     ],
     "errors": [
      {
       "condition": "xs empty",
       "raises": "ValueError"
      }
     ]
    }
   ],
   "probes": [
    {
     "id": "BP-01",
     "description": "The mean of a single element is that element",
     "input": "media([2.5])",
     "expected": "2.5",
     "kind": "example"
    },
    {
     "id": "BP-02",
     "description": "An empty list is rejected (α and β diverged; the intent says \"there is no average of nothing\")",
     "input": "media([])",
     "expected": "raises ValueError",
     "kind": "negative"
    },
    {
     "id": "BP-03",
     "description": "The order does not change the result beyond rounding error",
     "input": "xs: finite list[float], permutation p",
     "expected": "abs(media(xs) - media(p(xs))) <= 1e-9 * max(1, max(map(abs, xs)))",
     "kind": "property"
    }
   ],
   "assumptions": [
    {
     "id": "redondeo",
     "statement": "No rounding: the result is the IEEE 754 float of the division.",
     "source": "catalogue",
     "status": "accepted"
    },
    {
     "id": "listas-vacias",
     "statement": "An empty list is a caller error, not a 0.0.",
     "source": "catalogue",
     "status": "accepted"
    },
    {
     "id": "nan",
     "statement": "Does a NaN in xs propagate or get rejected?",
     "source": "specifier",
     "status": "open"
    }
   ],
   "pi_s": {
    "equivalence": "relaxed",
    "relaxations": [
     "float_tolerance:1e-9"
    ]
   }
  },
  "discrepancies": [
   {
    "topic": "media: empty list",
    "alpha": "lanza ValueError",
    "beta": "devuelve 0.0",
    "resolution": "raises ValueError: the intent says \"there is no average of nothing\" (catalogue: listas-vacias)"
   }
  ],
  "open_assumptions": [
   {
    "id": "nan",
    "statement": "Does a NaN in xs propagate or get rejected?",
    "source": "specifier",
    "status": "open"
   }
  ]
 }
}
