{
 "schema_version": 1,
 "run_id": "run-3f9a1c2b7d4e",
 "role": "builder_primary",
 "stage": "3",
 "attempt": 1,
 "status": "ok",
 "cost": {
  "usd": 0.183,
  "input_tokens": 40210,
  "cache_read_input_tokens": 31000,
  "cache_creation_input_tokens": 8000,
  "output_tokens": 3120,
  "turns": 7
 },
 "model": "claude-sonnet-4-5",
 "payload": {
  "summary": "media() raises ValueError with an empty list; fixed the parenthesis on line 14.",
  "files_changed": [
   "src/calc.py"
  ]
 }
}
