{
 "schema_version": 1,
 "run_id": "run-5d1e7a0c9b42",
 "role": "propose_properties",
 "stage": "propose",
 "attempt": 1,
 "status": "ok",
 "cost": { "usd": 0.004 },
 "payload": {
  "properties": [
   {
    "target": "src/calc.py::media",
    "property": "media of a non-empty list lies between its minimum and its maximum",
    "file": "tests/test_calc.py"
   }
  ]
 }
}
